{
  "contract": "typed_decision_request",
  "schema_version": "1.0.0",
  "request_id": "synthetic-document-completeness-request-0001",
  "capability_id": "synthetic.decision.document_completeness_score",
  "execution_paradigm": "typed_decision",
  "decision_type": "score",
  "bounded_state": {
    "facts": [
      {
        "fact_id": "document.required_fields",
        "value_type": "integer",
        "value": 8
      },
      {
        "fact_id": "document.present_fields",
        "value_type": "integer",
        "value": 6
      }
    ]
  },
  "question": {
    "question_id": "synthetic.document.completeness",
    "text": "On the declared 0-4 scale, how complete is this synthetic document?"
  },
  "output_domain": {
    "kind": "score",
    "scale_id": "synthetic.completeness.0_4",
    "minimum": 0,
    "maximum": 4
  },
  "policy": {
    "data_classification": "internal",
    "human_review_required": false,
    "abstention_permitted": true,
    "escalation_policy_ref": null,
    "downstream_use": "none"
  },
  "evidence_refs": []
}
